hid-decode /sys/bus/hid/devices/0003\:0CD4\:1112.0007/report_descriptor 
# device 0:0
# 0x05, 0x3c,                    // Usage Page (Vendor Usage Page 0x3c) 0
# 0x09, 0x00,                    // Usage (Vendor Usage 0x00)           2
# 0xa1, 0x01,                    // Collection (Application)            4
# 0x09, 0x00,                    //  Usage (Vendor Usage 0x00)          6
# 0x15, 0x00,                    //  Logical Minimum (0)                8
# 0x26, 0xff, 0x00,              //  Logical Maximum (255)              10
# 0x75, 0x08,                    //  Report Size (8)                    13
# 0x95, 0x06,                    //  Report Count (6)                   15
# 0x81, 0x02,                    //  Input (Data,Var,Abs)               17
# 0x09, 0x00,                    //  Usage (Vendor Usage 0x00)          19
# 0x15, 0x00,                    //  Logical Minimum (0)                21
# 0x26, 0xff, 0x00,              //  Logical Maximum (255)              23
# 0x75, 0x08,                    //  Report Size (8)                    26
# 0x95, 0x02,                    //  Report Count (2)                   28
# 0x91, 0x02,                    //  Output (Data,Var,Abs)              30
# 0x09, 0x00,                    //  Usage (Vendor Usage 0x00)          32
# 0x15, 0x00,                    //  Logical Minimum (0)                34
# 0x26, 0xff, 0x00,              //  Logical Maximum (255)              36
# 0x75, 0x08,                    //  Report Size (8)                    39
# 0x95, 0x20,                    //  Report Count (32)                  41
# 0xb1, 0x02,                    //  Feature (Data,Var,Abs)             43
# 0xc0,                          // End Collection                      45
# 
R: 46 05 3c 09 00 a1 01 09 00 15 00 26 ff 00 75 08 95 06 81 02 09 00 15 00 26 ff 00 75 08 95 02 91 02 09 00 15 00 26 ff 00 75 08 95 20 b1 02 c0
N: device 0:0
I: 3 0001 0001

